{
  "$id": "fr_prep_b10_research_disposition_contract.v1.schema.json",
  "$schema": "https://json-schema.org/draft/2020-12/schema",
  "additionalProperties": false,
  "properties": {
    "absolute_runtime_path_in_canonical_identity_count": {
      "const": 0
    },
    "b9_binding": {
      "properties": {
        "canonical_summary_sha256": {
          "const": "3c2cd0e4a2fcf6d970b592b942965d2f154873c3d7a225b38aa0eea6d5594bf5"
        },
        "decision": {
          "const": "FR_PREP_B9_PASS_SEALED_OBSERVATIONAL_OUTCOME_INTERPRETATION_REPORT"
        },
        "identity_validated": {
          "const": true
        },
        "output_hashes_validated": {
          "const": true
        },
        "schema_validated": {
          "const": true
        },
        "summary_projection_validated": {
          "const": true
        }
      },
      "required": [
        "canonical_summary_sha256",
        "decision",
        "identity_validated",
        "schema_validated",
        "summary_projection_validated",
        "output_hashes_validated"
      ],
      "type": "object"
    },
    "canonical_summary_sha256": {
      "pattern": "^[0-9a-f]{64}$"
    },
    "checkpoint": {
      "const": "FR_PREP_B10"
    },
    "conclusions": {
      "additionalProperties": false,
      "properties": {
        "candidate": {
          "const": "NOT_READY_FOR_ORDER_LOGIC"
        },
        "current_disposition": {
          "const": "NOT_SELECTED"
        },
        "disposition_execution": {
          "const": "NOT_STARTED"
        },
        "next_allowed_scope": {
          "const": "SEALED_RESEARCH_DISPOSITION_DECISION_ONLY"
        },
        "order_logic": {
          "const": "NOT_APPROVED"
        },
        "performance": {
          "const": "NOT_EVALUATED"
        },
        "profitability": {
          "const": "NOT_CLAIMED"
        },
        "research_disposition_contract": {
          "const": "FROZEN"
        },
        "robustness": {
          "const": "NOT_ESTABLISHED"
        },
        "strategy_edge": {
          "const": "NOT_ESTABLISHED"
        }
      },
      "required": [
        "research_disposition_contract",
        "disposition_execution",
        "current_disposition",
        "performance",
        "profitability",
        "strategy_edge",
        "robustness",
        "order_logic",
        "candidate",
        "next_allowed_scope"
      ],
      "type": "object"
    },
    "contract_scope": {
      "properties": {
        "b7_jsonl_or_statistics_parsed": {
          "const": false
        },
        "b9_markdown_parsed": {
          "const": false
        },
        "design_only": {
          "const": true
        },
        "disposition_executed": {
          "const": false
        },
        "disposition_selected": {
          "const": false
        },
        "outcomes_statistics_or_classifications_recomputed": {
          "const": false
        }
      },
      "required": [
        "design_only",
        "disposition_selected",
        "disposition_executed",
        "b7_jsonl_or_statistics_parsed",
        "b9_markdown_parsed",
        "outcomes_statistics_or_classifications_recomputed"
      ],
      "type": "object"
    },
    "coverage_rules": {
      "maxItems": 6,
      "minItems": 6,
      "type": "array"
    },
    "decision": {
      "const": "FR_PREP_B10_PASS_RESEARCH_DISPOSITION_CONTRACT_FROZEN"
    },
    "disposition_values": {
      "const": [
        "BLOCKED_EVIDENCE_INTEGRITY",
        "DATA_QUALITY_REMEDIATION_REQUIRED",
        "PREDECLARED_ADDITIONAL_HOLDOUT_REQUIRED",
        "ARCHIVE_AUDITED_DESCRIPTIVE_BASELINE"
      ]
    },
    "disposition_interpretation": {
      "maxItems": 5,
      "minItems": 5,
      "type": "array"
    },
    "execution_status": {
      "const": "PASS"
    },
    "forbidden_decision_inputs": {
      "maxItems": 9,
      "minItems": 9,
      "type": "array"
    },
    "future_decision_record_fields": {
      "maxItems": 9,
      "minItems": 9,
      "type": "array"
    },
    "future_decision_record_policy": {
      "properties": {
        "prohibited_claims_and_authorizations": {
          "additionalProperties": {
            "const": false
          },
          "minProperties": 8,
          "type": "object"
        },
        "raw_statistic_values_allowed": {
          "const": false
        },
        "selected_subgroup_allowed": {
          "const": false
        }
      },
      "required": [
        "prohibited_claims_and_authorizations",
        "raw_statistic_values_allowed",
        "selected_subgroup_allowed"
      ],
      "type": "object"
    },
    "mismatch_counters": {
      "additionalProperties": {
        "const": 0
      },
      "type": "object"
    },
    "negative_tests": {
      "properties": {
        "all_passed": {
          "const": true
        }
      },
      "required": [
        "test_count",
        "tests_passed",
        "all_passed",
        "results"
      ],
      "type": "object"
    },
    "permitted_future_inputs": {
      "maxItems": 13,
      "minItems": 13,
      "type": "array"
    },
    "prohibited_modules": {
      "maxItems": 0,
      "type": "array"
    },
    "rule_evaluation_policy": {
      "properties": {
        "evaluation_count": {
          "const": 1
        },
        "first_matching_rule_wins": {
          "const": true
        },
        "manual_override_allowed": {
          "const": false
        },
        "multiple_dispositions_allowed": {
          "const": false
        },
        "rule_order": {
          "const": [
            1,
            2,
            3,
            4
          ]
        },
        "score_or_weighting_allowed": {
          "const": false
        }
      },
      "required": [
        "rule_order",
        "evaluation_count",
        "first_matching_rule_wins",
        "manual_override_allowed",
        "score_or_weighting_allowed",
        "multiple_dispositions_allowed"
      ],
      "type": "object"
    },
    "rules": {
      "items": {
        "additionalProperties": false,
        "properties": {
          "condition": {
            "type": "string"
          },
          "disposition": {
            "type": "string"
          },
          "next_scope": {
            "type": "string"
          },
          "rule": {
            "minimum": 1,
            "type": "integer"
          }
        },
        "required": [
          "rule",
          "condition",
          "disposition",
          "next_scope"
        ],
        "type": "object"
      },
      "maxItems": 4,
      "minItems": 4,
      "type": "array"
    },
    "runtime_audit": {
      "type": "object"
    },
    "schema_version": {
      "const": "fr_prep_b10_research_disposition_contract.v1"
    }
  },
  "required": [
    "schema_version",
    "checkpoint",
    "decision",
    "execution_status",
    "canonical_summary_sha256",
    "b9_binding",
    "disposition_values",
    "disposition_interpretation",
    "rules",
    "rule_evaluation_policy",
    "permitted_future_inputs",
    "forbidden_decision_inputs",
    "coverage_rules",
    "future_decision_record_fields",
    "future_decision_record_policy",
    "contract_scope",
    "conclusions",
    "negative_tests",
    "mismatch_counters",
    "runtime_audit",
    "absolute_runtime_path_in_canonical_identity_count",
    "prohibited_modules"
  ],
  "type": "object"
}
